{
  "schemaVersion": 1,
  "assemblyName": "System.Collections.Immutable",
  "ownerSubjectId": "SolutionCorePack",
  "familyId": "family/System.Collections.Immutable/immutable/sorted/dictionary",
  "displayName": "Immutable Sorted Dictionary",
  "methodSubjectIds": [
    "System.Collections.Immutable/System.Collections.Immutable.ImmutableSortedDictionary::Create<string,int>:System.Collections.Immutable.ImmutableSortedDictionary<System.String,System.Int32>()",
    "System.Collections.Immutable/System.Collections.Immutable.ImmutableSortedDictionary::Create<Byte,Byte>:System.Collections.Immutable.ImmutableSortedDictionary<System.Byte,System.Byte>()"
  ],
  "methodSubjectCount": 2,
  "functionalObligation": {
    "required": true
  },
  "performanceObligation": {
    "required": false
  },
  "hotupdateFunctionalObligation": {
    "required": false
  },
  "hotupdatePerformanceObligation": {
    "required": false
  },
  "reviewBundleRequired": true,
  "customEntryIndices": [
    0,
    1
  ],
  "benchmarkMethodIndices": [],
  "hotupdateMethodIndices": []
}
