{
  "schemaVersion": 1,
  "assemblyName": "System.Private.CoreLib",
  "ownerSubjectId": "SolutionCorePack",
  "familyId": "family/System.Private.CoreLib/garbage-collection",
  "displayName": "Garbage Collection",
  "methodSubjectIds": [
    "System.Private.CoreLib/System.GC::Collect:System.Void()",
    "System.Private.CoreLib/System.GC::WaitForPendingFinalizers:System.Void()",
    "System.Private.CoreLib/System.GC::KeepAlive:System.Void(System.Object)",
    "System.Private.CoreLib/System.GC::GetGeneration:System.Int32(System.Object)",
    "System.Private.CoreLib/System.Array::CreateInstance:System.Array(System.Type,System.Int32)",
    "System.Private.CoreLib/System.GC::GetTotalMemory:System.Int64(System.Boolean)",
    "System.Private.CoreLib/System.GC::GetGCMemoryInfo: System.GCMemoryInfo()",
    "System.Private.CoreLib/System.GC::Collect(System.Int32,System.GCCollectionMode):System.Void()",
    "System.Private.CoreLib/System.GC::CollectionCount(System.Int32):System.Int64()",
    "System.Private.CoreLib/System.GC::GetTotalPauseDuration:System.TimeSpan()"
  ],
  "methodSubjectCount": 10,
  "functionalObligation": {
    "required": false
  },
  "performanceObligation": {
    "required": true
  },
  "hotupdateFunctionalObligation": {
    "required": false
  },
  "hotupdatePerformanceObligation": {
    "required": false
  },
  "reviewBundleRequired": true
}
