{
  "schemaVersion": 1,
  "assemblyName": "System.Private.CoreLib",
  "ownerSubjectId": "SolutionCorePack",
  "familyId": "family/System.Private.CoreLib/span/memory-buffers",
  "displayName": "Span Memory Buffers",
  "methodSubjectIds": [
    "System.Private.CoreLib/System.Span`1::get_Item:T&(System.Int32)",
    "System.Private.CoreLib/System.Span`1::Slice:System.Span`1(System.Int32)",
    "System.Private.CoreLib/System.Span`1::Slice:System.Span`1(System.Int32,System.Int32)",
    "System.Private.CoreLib/System.Span`1::ToArray:T[](System.Int32)",
    "System.Private.CoreLib/System.Span`1::CopyTo:System.Void(System.Span`1)",
    "System.Private.CoreLib/System.Span`1::get_Empty:System.Span`1()",
    "System.Private.CoreLib/System.ReadOnlySpan`1::get_Item:T&(System.Int32)",
    "System.Private.CoreLib/System.ReadOnlySpan`1::Slice:System.ReadOnlySpan`1(System.Int32)",
    "System.Private.CoreLib/System.ReadOnlySpan`1::ToArray:T[]()",
    "System.Private.CoreLib/System.Memory`1::Slice:System.Memory`1(System.Int32)",
    "System.Private.CoreLib/System.Memory`1::get_Span:System.Span`1()",
    "System.Private.CoreLib/System.Memory`1::ToArray:T[]()",
    "System.Private.CoreLib/System.Runtime.InteropServices.MemoryMarshal::GetReference:T&(System.ReadOnlySpan`1)",
    "System.Private.CoreLib/System.Runtime.InteropServices.MemoryMarshal::GetReference:T&(System.Span`1)"
  ],
  "methodSubjectCount": 14,
  "functionalObligation": {
    "required": true
  },
  "performanceObligation": {
    "required": false
  },
  "hotupdateFunctionalObligation": {
    "required": false
  },
  "hotupdatePerformanceObligation": {
    "required": false
  },
  "reviewBundleRequired": true,
  "customEntryIndices": [],
  "benchmarkMethodIndices": [
    0,
    1,
    2,
    3,
    4,
    5,
    6,
    7,
    8,
    9,
    10,
    11,
    12,
    13
  ],
  "hotupdateMethodIndices": [
    0,
    1,
    2,
    3,
    5,
    6,
    7,
    8,
    9,
    10,
    11,
    12,
    13
  ]
}
